<?xml version="1.0" encoding="UTF-8"?>
<!DOCTYPE FiniteAutomaton SYSTEM "FA.dtd">
<FiniteAutomaton type="DFA" name="Graph_2_22">
    <States>
        <State stateID="Q01">
            <StateTypes>
                <StateType type="INITIAL"/>
            </StateTypes>
        </State>
        <State stateID="Q1">
            <StateTypes>
                <StateType type="COMMON"/>
            </StateTypes>
        </State>
        <State stateID="Q14">
            <StateTypes>
                <StateType type="COMMON"/>
            </StateTypes>
        </State>
        <State stateID="Q2">
            <StateTypes>
                <StateType type="COMMON"/>
            </StateTypes>
        </State>
        <State stateID="Q235">
            <StateTypes>
                <StateType type="FINAL"/>
            </StateTypes>
        </State>
        <State stateID="Q35">
            <StateTypes>
                <StateType type="FINAL"/>
            </StateTypes>
        </State>
    </States>
    <InputSymbols>
        <InputSymbol symbol="Dot"/>
        <InputSymbol symbol="Pos"/>
        <InputSymbol symbol="Neg"/>
        <InputSymbol symbol="s0"/>
        <InputSymbol symbol="s1"/>
        <InputSymbol symbol="s2"/>
        <InputSymbol symbol="s3"/>
        <InputSymbol symbol="s4"/>
        <InputSymbol symbol="s5"/>
        <InputSymbol symbol="s6"/>
        <InputSymbol symbol="s7"/>
        <InputSymbol symbol="s8"/>
        <InputSymbol symbol="s9"/>
    </InputSymbols>
    <Transitions>
        <Transition>
            <FromState stateID="Q01"/>
            <Conditions>
                <Condition symbol="Pos"/>
                <Condition symbol="Neg"/>
            </Conditions>
            <ToStates>
                <ToState stateID="Q1"/>
            </ToStates>
        </Transition>
        <Transition>
            <FromState stateID="Q01"/>
            <Conditions>
                <Condition symbol="s0"/>
                <Condition symbol="s1"/>
                <Condition symbol="s2"/>
                <Condition symbol="s3"/>
                <Condition symbol="s4"/>
                <Condition symbol="s5"/>
                <Condition symbol="s6"/>
                <Condition symbol="s7"/>
                <Condition symbol="s8"/>
                <Condition symbol="s9"/>
            </Conditions>
            <ToStates>
                <ToState stateID="Q14"/>
            </ToStates>
        </Transition>
        <Transition>
            <FromState stateID="Q1"/>
            <Conditions>
                <Condition symbol="s0"/>
                <Condition symbol="s1"/>
                <Condition symbol="s2"/>
                <Condition symbol="s3"/>
                <Condition symbol="s4"/>
                <Condition symbol="s5"/>
                <Condition symbol="s6"/>
                <Condition symbol="s7"/>
                <Condition symbol="s8"/>
                <Condition symbol="s9"/>
            </Conditions>
            <ToStates>
                <ToState stateID="Q14"/>
            </ToStates>
        </Transition>
        <Transition>
            <FromState stateID="Q14"/>
            <Conditions>
                <Condition symbol="s0"/>
                <Condition symbol="s1"/>
                <Condition symbol="s2"/>
                <Condition symbol="s3"/>
                <Condition symbol="s4"/>
                <Condition symbol="s5"/>
                <Condition symbol="s6"/>
                <Condition symbol="s7"/>
                <Condition symbol="s8"/>
                <Condition symbol="s9"/>
            </Conditions>
            <ToStates>
                <ToState stateID="Q14"/>
            </ToStates>
        </Transition>
        <Transition>
            <FromState stateID="Q01"/>
            <Conditions>
                <Condition symbol="Dot"/>
            </Conditions>
            <ToStates>
                <ToState stateID="Q2"/>
            </ToStates>
        </Transition>
        <Transition>
            <FromState stateID="Q1"/>
            <Conditions>
                <Condition symbol="Dot"/>
            </Conditions>
            <ToStates>
                <ToState stateID="Q2"/>
            </ToStates>
        </Transition>
        <Transition>
            <FromState stateID="Q14"/>
            <Conditions>
                <Condition symbol="Dot"/>
            </Conditions>
            <ToStates>
                <ToState stateID="Q235"/>
            </ToStates>
        </Transition>
        <Transition>
            <FromState stateID="Q2"/>
            <Conditions>
                <Condition symbol="s0"/>
                <Condition symbol="s1"/>
                <Condition symbol="s2"/>
                <Condition symbol="s3"/>
                <Condition symbol="s4"/>
                <Condition symbol="s5"/>
                <Condition symbol="s6"/>
                <Condition symbol="s7"/>
                <Condition symbol="s8"/>
                <Condition symbol="s9"/>
            </Conditions>
            <ToStates>
                <ToState stateID="Q35"/>
            </ToStates>
        </Transition>
        <Transition>
            <FromState stateID="Q35"/>
            <Conditions>
                <Condition symbol="s0"/>
                <Condition symbol="s1"/>
                <Condition symbol="s2"/>
                <Condition symbol="s3"/>
                <Condition symbol="s4"/>
                <Condition symbol="s5"/>
                <Condition symbol="s6"/>
                <Condition symbol="s7"/>
                <Condition symbol="s8"/>
                <Condition symbol="s9"/>
            </Conditions>
            <ToStates>
                <ToState stateID="Q35"/>
            </ToStates>
        </Transition>
        <Transition>
            <FromState stateID="Q235"/>
            <Conditions>
                <Condition symbol="s0"/>
                <Condition symbol="s1"/>
                <Condition symbol="s2"/>
                <Condition symbol="s3"/>
                <Condition symbol="s4"/>
                <Condition symbol="s5"/>
                <Condition symbol="s6"/>
                <Condition symbol="s7"/>
                <Condition symbol="s8"/>
                <Condition symbol="s9"/>
            </Conditions>
            <ToStates>
                <ToState stateID="Q35"/>
            </ToStates>
        </Transition>
    </Transitions>
</FiniteAutomaton>