<?xml version="1.0" encoding="UTF-8"?>
<!DOCTYPE FiniteAutomaton SYSTEM "FA.dtd">
<FiniteAutomaton type="NFA" name="graph 2.18">
    <States>
        <State stateID="q0">
            <StateTypes>
                <StateType type="INITIAL"/>
            </StateTypes>
        </State>
        <State stateID="q1">
            <StateTypes>
                <StateType type="COMMON"/>
            </StateTypes>
        </State>
        <State stateID="q2">
            <StateTypes>
                <StateType type="COMMON"/>
            </StateTypes>
        </State>
        <State stateID="q3">
            <StateTypes>
                <StateType type="COMMON"/>
            </StateTypes>
        </State>
        <State stateID="q4">
            <StateTypes>
                <StateType type="COMMON"/>
            </StateTypes>
        </State>
        <State stateID="q5">
            <StateTypes>
                <StateType type="FINAL"/>
            </StateTypes>
        </State>
    </States>
    <InputSymbols>
        <InputSymbol symbol="s0"/>
        <InputSymbol symbol="s1"/>
        <InputSymbol symbol="s2"/>
        <InputSymbol symbol="s3"/>
        <InputSymbol symbol="s4"/>
        <InputSymbol symbol="s5"/>
        <InputSymbol symbol="s6"/>
        <InputSymbol symbol="s7"/>
        <InputSymbol symbol="s8"/>
        <InputSymbol symbol="s9"/>
        <InputSymbol symbol="dot"/>
        <InputSymbol symbol="pos"/>
        <InputSymbol symbol="neg"/>
    </InputSymbols>
    <Transitions>
        <Transition>
            <FromState stateID="q0"/>
            <Conditions>
                <Condition symbol="pos"/>
                <Condition symbol="neg"/>
            </Conditions>
            <ToStates>
                <ToState stateID="q1"/>
            </ToStates>
        </Transition>
        <Transition>
            <FromState stateID="q0"/>
            <ToStates>
                <ToState stateID="q1"/>
            </ToStates>
        </Transition>         
        <Transition>
            <FromState stateID="q1"/>
            <Conditions>
                <Condition symbol="s0"/>
                <Condition symbol="s1"/>
                <Condition symbol="s2"/>
                <Condition symbol="s3"/>
                <Condition symbol="s4"/>
                <Condition symbol="s5"/>
                <Condition symbol="s6"/>
                <Condition symbol="s7"/>
                <Condition symbol="s8"/>
                <Condition symbol="s9"/>
            </Conditions>
            <ToStates>
                <ToState stateID="q4"/>
                <ToState stateID="q1"/>
            </ToStates>
        </Transition>
        <Transition>
            <FromState stateID="q1"/>
            <Conditions>
                <Condition symbol="dot"/>
            </Conditions>
            <ToStates>
                <ToState stateID="q2"/>
            </ToStates>
        </Transition>
        <Transition>
            <FromState stateID="q4"/>
            <Conditions>
                <Condition symbol="dot"/>
            </Conditions>
            <ToStates>
                <ToState stateID="q3"/>
            </ToStates>
        </Transition>
        <Transition>
            <FromState stateID="q2"/>
            <Conditions>
                <Condition symbol="s0"/>
                <Condition symbol="s1"/>
                <Condition symbol="s2"/>
                <Condition symbol="s3"/>
                <Condition symbol="s4"/>
                <Condition symbol="s5"/>
                <Condition symbol="s6"/>
                <Condition symbol="s7"/>
                <Condition symbol="s8"/>
                <Condition symbol="s9"/>
            </Conditions>
            <ToStates>
                <ToState stateID="q3"/>
            </ToStates>
        </Transition>
        <Transition>
            <FromState stateID="q3"/>
            <Conditions>
                <Condition symbol="s0"/>
                <Condition symbol="s1"/>
                <Condition symbol="s2"/>
                <Condition symbol="s3"/>
                <Condition symbol="s4"/>
                <Condition symbol="s5"/>
                <Condition symbol="s6"/>
                <Condition symbol="s7"/>
                <Condition symbol="s8"/>
                <Condition symbol="s9"/>
            </Conditions>
            <ToStates>
                <ToState stateID="q3"/>
            </ToStates>
        </Transition>
        <Transition>
            <FromState stateID="q3"/>
            <ToStates>
                <ToState stateID="q5"/>
            </ToStates>
        </Transition>
    </Transitions>
</FiniteAutomaton>