<?xml version="1.0" encoding="UTF-8"?>
<!DOCTYPE FiniteAutomaton SYSTEM "FA.dtd">
<FiniteAutomaton type="NFA" name="exercise 2.5.2" >
    <States>
        <State stateID="p">
            <StateTypes>
                <StateType type="INITIAL"/>
                <StateType type="COMMON"/>
            </StateTypes>
        </State>
        <State stateID="q">
            <StateTypes>
                <StateType type="COMMON"/>
            </StateTypes>
        </State>
        <State stateID="r">
            <StateTypes>
                <StateType type="FINAL"/>
                <StateType type="COMMON"/>
            </StateTypes>
        </State>
    </States>
    <InputSymbols>
        <InputSymbol symbol="a"/>
        <InputSymbol symbol="b"/>
        <InputSymbol symbol="c"/>
    </InputSymbols>
    <Transitions>
        <Transition>
            <FromState stateID="p"/>
            <ToStates>
                <ToState stateID="q"/>
                <ToState stateID="r"/>
            </ToStates>
        </Transition>
        <Transition>
            <FromState stateID="p"/>
            <Conditions>
                <Condition symbol="b"/>
            </Conditions>
            <ToStates>
                <ToState stateID="q"/>
            </ToStates>
        </Transition>
        <Transition>
            <FromState stateID="p"/>
            <Conditions>
                <Condition symbol="c"/>
            </Conditions>
            <ToStates>
                <ToState stateID="r"/>
            </ToStates>
        </Transition>
        <Transition>
            <FromState stateID="q"/>
            <Conditions>
                <Condition symbol="a"/>
            </Conditions>
            <ToStates>
                <ToState stateID="p"/>
            </ToStates>
        </Transition>
        <Transition>
            <FromState stateID="q"/>
            <Conditions>
                <Condition symbol="b"/>
            </Conditions>
            <ToStates>
                <ToState stateID="r"/>
            </ToStates>
        </Transition>
        <Transition>
            <FromState stateID="q"/>
            <Conditions>
                <Condition symbol="c"/>
            </Conditions>
            <ToStates>
                <ToState stateID="p"/>
                <ToState stateID="q"/>
            </ToStates>
        </Transition>
    </Transitions>
</FiniteAutomaton>