<?xml version="1.0" encoding="UTF-8"?>
<!DOCTYPE FiniteAutomaton SYSTEM "FA.dtd">

<FiniteAutomaton type="NFA">
    <States>
        <State stateID="P1">
            <StateTypes>
                <StateType type="INITIAL"/>
                <StateType type="FINAL"/>
            </StateTypes>
        </State>
        <State stateID="P2">
            <StateTypes>
                <StateType type="COMMON"/>
            </StateTypes>
        </State>
    </States>
    <InputSymbols>
        <InputSymbol symbol="a"/>
        <InputSymbol symbol="b"/>
    </InputSymbols>
    <Transitions>
        <Transition>
            <FromState stateID="P1"/>
            <Conditions>
                <Condition symbol="a"/>
            </Conditions>
            <ToStates>
                <ToState stateID="P1"/>
            </ToStates>
        </Transition>
        <Transition>
            <FromState stateID="P1"/>
            <Conditions>
                <Condition symbol="a"/>
            </Conditions>
            <ToStates>
                <ToState stateID="P2"/>
            </ToStates>
        </Transition>
    </Transitions>
</FiniteAutomaton>